{
  "site": {
    "title": "ドキュメントサイト",
    "tagline": "知識と手順を整理する",
    "url": "https://example.com",
    "baseUrl": "/",
    "onBrokenLinks": "throw",
    "onBrokenAnchors": "throw",
    "onDuplicateRoutes": "throw",
    "markdown": {
      "format": "md",
      "hooks": {
        "onBrokenMarkdownLinks": "throw",
        "onBrokenMarkdownImages": "throw"
      }
    },
    "i18n": {
      "defaultLocale": "ja",
      "locales": [
        "ja"
      ]
    }
  },
  "preset": {
    "docs": {
      "sidebarPath": "./sidebars.ts",
      "routeBasePath": "docs"
    },
    "blog": false
  },
  "theme": {
    "colorMode": {
      "respectPrefersColorScheme": true
    },
    "navbar": {
      "title": "ドキュメントサイト",
      "items": [
        {
          "type": "docSidebar",
          "sidebarId": "docsSidebar",
          "label": "ドキュメント",
          "position": "left"
        }
      ]
    }
  },
  "sidebar": {
    "docsSidebar": [
      {
        "type": "autogenerated",
        "dirName": "."
      }
    ]
  },
  "documents": {},
  "categories": {},
  "typescript": {
    "extends": "@docusaurus/tsconfig",
    "compilerOptions": {
      "strict": true,
      "resolveJsonModule": true,
      "ignoreDeprecations": "6.0",
      "types": [
        "node",
        "@docusaurus/module-type-aliases",
        "@docusaurus/theme-classic"
      ]
    },
    "include": [
      "docusaurus.config.ts",
      "sidebars.ts",
      "src/**/*",
      "plugins/**/*.d.ts",
      "playwright.config.ts",
      "tests/browser/**/*.ts"
    ],
    "exclude": [
      "node_modules",
      "build",
      ".docusaurus"
    ]
  },
  "playwright": {
    "testDir": "./tests/browser",
    "fullyParallel": false,
    "workers": 1,
    "timeout": 30000,
    "use": {
      "baseURL": "http://127.0.0.1:4186/preview/",
      "browserName": "chromium",
      "trace": "retain-on-failure",
      "screenshot": "only-on-failure"
    }
  },
  "custom": {
    "home": {
      "heading": "知識と手順を、読める形に。",
      "body": "記事を書き、関連する情報をつなぎ、検索できるドキュメントサイトです。",
      "linkLabel": "ドキュメントを読む",
      "linkTo": "/docs/intro"
    },
    "search": {
      "enabled": true,
      "limit": 8,
      "excerptLength": 150,
      "titleWeight": 10,
      "include": [
        "**"
      ],
      "exclude": [],
      "label": "文書を検索",
      "placeholder": "キーワードを入力…",
      "emptyMessage": "文書名やキーワードで検索できます。",
      "noResultsMessage": "一致する文書はありません。",
      "shortcut": "k"
    }
  }
}
